{
  "$schema": "https://json-schema.org/draft/2020-12/schema",
  "$id": "https://raw.githubusercontent.com/renezander030/agent-approval-gate/v3.4.0/schemas/proposed-action.schema.json",
  "title": "ProposedAction",
  "description": "An immutable, serializable action draft. The RFC 8785 SHA-256 digest of this complete document is the action_hash carried through approval and dispatch.",
  "type": "object",
  "required": [
    "schema_version",
    "proposal_id",
    "call_id",
    "agent",
    "delegation_chain",
    "action_type",
    "payload_schema",
    "payload",
    "created_at",
    "expires_at",
    "tenant",
    "risk",
    "idempotency_key"
  ],
  "additionalProperties": false,
  "properties": {
    "schema_version": {"$ref": "common.schema.json#/$defs/schema_version"},
    "proposal_id": {"$ref": "common.schema.json#/$defs/identifier"},
    "call_id": {"$ref": "common.schema.json#/$defs/identifier"},
    "parent_call_id": {"$ref": "common.schema.json#/$defs/identifier"},
    "agent": {"$ref": "common.schema.json#/$defs/agent_identity"},
    "delegation_chain": {
      "type": "array",
      "minItems": 1,
      "maxItems": 16,
      "items": {
        "type": "object",
        "required": ["agent", "call_id", "delegated_at"],
        "additionalProperties": false,
        "properties": {
          "agent": {"$ref": "common.schema.json#/$defs/agent_identity"},
          "call_id": {"$ref": "common.schema.json#/$defs/identifier"},
          "parent_call_id": {"$ref": "common.schema.json#/$defs/identifier"},
          "delegated_at": {"type": "string", "format": "date-time"}
        }
      }
    },
    "action_type": {
      "type": "string",
      "enum": [
        "email.send",
        "crm.update_record",
        "ticket.create",
        "db.update_row",
        "api.call",
        "n8n.trigger_workflow",
        "shell.exec",
        "file.write",
        "network.egress"
      ]
    },
    "payload_schema": {
      "type": "object",
      "required": ["id", "version", "digest"],
      "additionalProperties": false,
      "properties": {
        "id": {"type": "string", "format": "uri", "maxLength": 2048},
        "version": {"type": "string", "pattern": "^[0-9]+\\.[0-9]+\\.[0-9]+$"},
        "digest": {"$ref": "common.schema.json#/$defs/digest"}
      }
    },
    "payload": {"type": "object"},
    "rationale": {"type": "string", "maxLength": 4000},
    "created_at": {"type": "string", "format": "date-time"},
    "expires_at": {"type": "string", "format": "date-time"},
    "tenant": {"type": "string", "minLength": 1, "maxLength": 64},
    "risk": {"type": "string", "enum": ["low", "medium", "high"]},
    "idempotency_key": {"$ref": "common.schema.json#/$defs/identifier"},
    "effects": {"$ref": "common.schema.json#/$defs/effect_hints"},
    "target_precondition": {"$ref": "common.schema.json#/$defs/target_precondition"},
    "review_evidence": {
      "type": "array",
      "maxItems": 20,
      "items": {"$ref": "common.schema.json#/$defs/evidence_reference"}
    }
  },
  "allOf": [
    {
      "if": {
        "properties": {"action_type": {"const": "email.send"}},
        "required": ["action_type"]
      },
      "then": {
        "properties": {"payload": {"$ref": "actions/email.send.schema.json"}}
      }
    },
    {
      "if": {
        "properties": {"action_type": {"const": "crm.update_record"}},
        "required": ["action_type"]
      },
      "then": {
        "properties": {"payload": {"$ref": "actions/crm.update_record.schema.json"}}
      }
    },
    {
      "if": {
        "properties": {"action_type": {"const": "ticket.create"}},
        "required": ["action_type"]
      },
      "then": {
        "properties": {"payload": {"$ref": "actions/ticket.create.schema.json"}}
      }
    },
    {
      "if": {
        "properties": {"action_type": {"const": "db.update_row"}},
        "required": ["action_type"]
      },
      "then": {
        "properties": {"payload": {"$ref": "actions/db.update_row.schema.json"}}
      }
    },
    {
      "if": {
        "properties": {"action_type": {"const": "api.call"}},
        "required": ["action_type"]
      },
      "then": {
        "properties": {"payload": {"$ref": "actions/api.call.schema.json"}}
      }
    },
    {
      "if": {
        "properties": {"action_type": {"const": "n8n.trigger_workflow"}},
        "required": ["action_type"]
      },
      "then": {
        "properties": {"payload": {"$ref": "actions/n8n.trigger_workflow.schema.json"}}
      }
    },
    {
      "if": {
        "properties": {"action_type": {"const": "shell.exec"}},
        "required": ["action_type"]
      },
      "then": {
        "properties": {"payload": {"$ref": "actions/shell.exec.schema.json"}}
      }
    },
    {
      "if": {
        "properties": {"action_type": {"const": "file.write"}},
        "required": ["action_type"]
      },
      "then": {
        "properties": {"payload": {"$ref": "actions/file.write.schema.json"}}
      }
    },
    {
      "if": {
        "properties": {"action_type": {"const": "network.egress"}},
        "required": ["action_type"]
      },
      "then": {
        "properties": {"payload": {"$ref": "actions/network.egress.schema.json"}}
      }
    }
  ]
}
