{
  "schema_version": "3.2.0",
  "proposal_id": "prop_2026-04-28_b3f1a2c4",
  "call_id": "call_2026-04-28_7e19c5ad",
  "agent": {
    "identity": "agent.support-triage.prod",
    "name": "support-triage-agent",
    "version": "1.4.2",
    "model": "claude-opus-4-7",
    "run_id": "run_2026-04-28_5f9e2c00"
  },
  "delegation_chain": [
    {
      "agent": {
        "identity": "agent.support-triage.prod",
        "name": "support-triage-agent",
        "version": "1.4.2",
        "model": "claude-opus-4-7",
        "run_id": "run_2026-04-28_5f9e2c00"
      },
      "call_id": "call_2026-04-28_7e19c5ad",
      "delegated_at": "2026-04-28T09:14:23Z"
    }
  ],
  "action_type": "email.send",
  "payload_schema": {
    "id": "https://raw.githubusercontent.com/renezander030/agent-approval-gate/v3.2.0/schemas/actions/email.send.schema.json",
    "version": "3.2.0",
    "digest": "sha256:c099778c6a1bd68512555b9db663a071c626fa713592ee35c1bfc23ef34176e7"
  },
  "payload": {
    "from": "support@acme-corp.example",
    "to": [
      "customer@example.com"
    ],
    "cc": [],
    "subject": "Re: cannot export invoices for March",
    "body_text": "Hi,\n\nThanks for the report. The export endpoint was rate-limited above the documented threshold last week — we've raised it back to 50 req/min. Please retry the March export and let us know if it still fails.\n\nIf you need the data sooner, I can run the export on our side and email you the CSV directly.\n\nBest,\nSupport",
    "in_reply_to_message_id": "<CADx7HnZ@example.com>",
    "ticket_id": "ZD-48211"
  },
  "rationale": "The export issue maps to the documented rate-limit incident. Confirm the fix and offer a manual export as fallback.",
  "created_at": "2026-04-28T09:14:23Z",
  "expires_at": "2026-04-28T17:14:23Z",
  "tenant": "acme-corp",
  "risk": "high",
  "idempotency_key": "idem_email_ZD-48211_reply_01"
}
